{
  "id": "11111111-1111-4111-8111-111111111111",
  "organization_id": "22222222-2222-4222-8222-222222222222",
  "workspace_id": "33333333-3333-4333-8333-333333333333",
  "conversation_id": null,
  "created_by_user_id": "44444444-4444-4444-8444-444444444444",
  "status": "queued",
  "created_at": "2026-07-18T12:00:00.000Z",
  "updated_at": "2026-07-18T12:00:00.000Z",
  "started_at": null,
  "completed_at": null,
  "error": null,
  "metadata": { "source": "api" }
}
